{
  "$schema": "https://json-schema.org/draft/2020-12/schema",
  "$id": "https://theparitt.github.io/sppa-protocol/schemas/runtime-status/0.1.0-draft.1/snapshot.schema.json",
  "title": "SPPA Runtime Status profile 0.1.0-draft.1",
  "type": "object",
  "properties": {
    "profile": {
      "const": "runtime-status/0.1.0-draft.1"
    },
    "provider_id": {
      "type": "string",
      "minLength": 1,
      "maxLength": 128
    },
    "capability_ref": {
      "type": "object",
      "properties": {
        "id": {
          "type": "string",
          "minLength": 1,
          "maxLength": 128
        },
        "version": {
          "type": "string",
          "minLength": 1,
          "maxLength": 128
        }
      },
      "required": [
        "id",
        "version"
      ],
      "additionalProperties": false
    },
    "scope": {
      "type": "string",
      "enum": [
        "provider_capability"
      ]
    },
    "publisher_id": {
      "type": "string",
      "minLength": 1,
      "maxLength": 128
    },
    "publisher_epoch": {
      "type": "string",
      "minLength": 1,
      "maxLength": 128
    },
    "sequence": {
      "type": "integer",
      "minimum": 0,
      "maximum": 9007199254740991
    },
    "source": {
      "type": "object",
      "properties": {
        "kind": {
          "type": "string",
          "enum": [
            "provider_report",
            "observer_probe"
          ]
        },
        "id": {
          "type": "string",
          "minLength": 1,
          "maxLength": 128
        }
      },
      "required": [
        "kind",
        "id"
      ],
      "additionalProperties": false
    },
    "observed_at": {
      "type": "string",
      "format": "date-time",
      "pattern": "^\\d{4}-\\d{2}-\\d{2}T\\d{2}:\\d{2}:[0-5]\\d(?:\\.\\d{1,3})?Z$"
    },
    "expires_at": {
      "type": "string",
      "format": "date-time",
      "pattern": "^\\d{4}-\\d{2}-\\d{2}T\\d{2}:\\d{2}:[0-5]\\d(?:\\.\\d{1,3})?Z$"
    },
    "received_at": {
      "type": "string",
      "format": "date-time",
      "pattern": "^\\d{4}-\\d{2}-\\d{2}T\\d{2}:\\d{2}:[0-5]\\d(?:\\.\\d{1,3})?Z$"
    },
    "reachability": {
      "type": "string",
      "enum": [
        "reachable",
        "unreachable",
        "unknown"
      ]
    },
    "health": {
      "type": "string",
      "enum": [
        "healthy",
        "degraded",
        "unavailable",
        "unknown"
      ]
    },
    "admission_state": {
      "type": "string",
      "enum": [
        "accepting",
        "queue_only",
        "rejecting",
        "unknown"
      ]
    },
    "reason_codes": {
      "type": "array",
      "items": {
        "type": "string",
        "pattern": "^[a-z][a-z0-9_]{0,63}$"
      },
      "uniqueItems": true,
      "maxItems": 32
    },
    "capacity": {
      "anyOf": [
        {
          "type": "object",
          "properties": {
            "max_concurrency": {
              "type": "integer",
              "minimum": 1,
              "maximum": 9007199254740991
            },
            "running_jobs": {
              "type": "integer",
              "minimum": 0,
              "maximum": 9007199254740991
            },
            "available_slots": {
              "type": "integer",
              "minimum": 0,
              "maximum": 9007199254740991
            },
            "waiting_jobs": {
              "type": "integer",
              "minimum": 0,
              "maximum": 9007199254740991
            },
            "max_waiting_jobs": {
              "type": "integer",
              "minimum": 0,
              "maximum": 9007199254740991
            },
            "queue_enabled": {
              "type": "boolean"
            },
            "queue_policy": {
              "type": "string",
              "enum": [
                "fifo"
              ]
            }
          },
          "required": [
            "max_concurrency",
            "running_jobs",
            "available_slots",
            "waiting_jobs",
            "max_waiting_jobs",
            "queue_enabled",
            "queue_policy"
          ],
          "additionalProperties": false
        },
        {
          "type": "null"
        }
      ]
    }
  },
  "required": [
    "profile",
    "provider_id",
    "capability_ref",
    "scope",
    "publisher_id",
    "publisher_epoch",
    "sequence",
    "source",
    "observed_at",
    "expires_at",
    "received_at",
    "reachability",
    "health",
    "admission_state",
    "reason_codes",
    "capacity"
  ],
  "additionalProperties": false
}
